Product_Name,Clause_Name,Chapter,Article,Subsection,Full_Content,Page
hanwha_gain_241216,보통약관,test,제1조(용어의 정의),test2,"이 약관에서 사용하는 용어의 뜻은 다음과 같습니다. 1. 가지급금 : 자동차사고로 인하여 소요되는 비용을 충당하기 위하여, 보험회 사가 피보험자에 대한 보상책임이나 피해자에 대한 손해배상책임을 확정하 기 전에 그 비용의 일부를 피보험자 또는 피해자에게 미리 지급하는 것을 말합니다. 2. 단기요율1) : 보험기간이 1년 미만인 보험계약에 적용되는 보험요율을 말합 니다. 3. 마약 또는 약물 등 : 「도로교통법」 제45조에서 정한 ‘마약, 대마, 향정신성 의약품2) 그 밖의 행정안전부령이 정하는 것’을 말합니다. 4. 무면허운전(조종) : 「도로교통법」 또는 「건설기계관리법」의 운전(조종)면허 에 관한 규정에 위반되는 무면허 또는 무자격운전(조종)을 말하며, 운전(조 종)면허의 효력이 정지된 상황이거나 운전(조종)이 금지된 상황에서 운전 (조종)하는 것을 포함합니다. 5. 무보험자동차3) : 피보험자동차가 아니면서 피보험자를 죽게 하거나 다치게 한 자동차로서 다음 중 어느 하나에 해당하는 것을 말합니다. 이 경우 자동 차라 함은 「자동차관리법」에 의한 자동차, 「건설기계관리법」에 의한 건설기 계, 「군수품관리법」에 의한 차량, 「도로교통법」에 의한 원동기장치자전거 및 개인형이동장치, 「농업기계화촉진법」에 의한 농업기계를 말하며, 피보험자 가 소유한 자동차를 제외합니다. 가. 자동차보험 「대인배상Ⅱ」나 공제계약이 없는 자동차 나. 자동차보험 「대인배상Ⅱ」나 공제계약에서 보상하지 않는 경우에 해당하 는 자동차 다. 이 약관에서 보상될 수 있는 금액보다 보상한도가 낮은 자동차보험의 「대인배상Ⅱ」나 공제계약이 적용되는 자동차. 다만, 피보험자를 죽게 하 거나 다치게 한 자동차가 2대 이상이고 각각의 자동차에 적용되는 자동차 보험의 「대인배상Ⅱ」 또는 공제계약에서 보상되는 금액의 합계액이 이 약관에서 보상될 수 있는 금액보다 낮은 경우에 한하는 그 각각의 자동차 라. 피보험자를 죽게 하거나, 다치게 한 자동차가 명확히 밝혀지지 않은 경 우 그 자동차(「도로교통법」에 의한 개인형이동장치는 제외) 6. 부분품, 부속품, 부속기계장치 1) 요율(料率) 보험료 계산 시 가입조건에 따라 적용되는 보험료 수준 등을 말합니다. 2) 향정신성의약품 인간의 중추신경계에 작용하는 것으로서 오용하거나 남용할 경우 인체에 심각한 위해가 있다고 인정되는 의약품을 말합니다. 3) 무보험자동차 예시 가. 의무보험만 가입한 자동차 나. 운전자 연령한정 특약 등 위배시 다. 손해액이 대인배상Ⅱ 가입금액을 초과시 라. 뺑소니에 의한 사고시  가. 부분품 : 엔진, 변속기(트랜스미션) 등 자동차가 공장에서 출고될 때 원 형 그대로 부착되어 자동차의 조성부분이 되는 재료를 말합니다. 나. 부속품 : 자동차에 정착(*1) 또는 장비(*2)되어 있는 물품을 말하며, 자동 차 실내에서만 사용하는 것을 목적으로 해서 자동차에 고정되어 있는 내비게이션이나 고속도로통행료단말기(*3)를 포함합니다. 다만 다음의 물품을 제외합니다. (1) 연료, 보디커버, 세차용품 (2) 법령4)에 의해 자동차에 정착(*1)하거나 장비(*2)하는 것이 금지되어 있는 물건4) (3) 통상 장식품으로 보는 물건 (4) 부속기계장치 다. 부속기계장치: 의료방역차, 검사측정차, 전원차, 방송중계차 등 자동차 등록증상 그 용도가 특정한 자동차에 정착되거나 장비되어 있는 정밀기 계장치를 말합니다. (*1) 정착 : 볼트, 너트 등으로 고정되어 있어서 공구 등을 사용하지 않으면 쉽게 분리할 수 없는 상태 (*2) 장비 : 자동차의 기능을 충분히 발휘하기 위해 갖추어 두고 있는 상태 또는 법령에 따라 자동차에 갖추어 두고 있는 상태 (*3) 고속도로통행료단말기 : 고속도로 통행료 등의 지급을 위해 고속도로 요금 소와 통행료 등에 관한 정보를 주고받는 송수신장치(예 : 하이패스 단말기) 7. 운전(조종)5) : 「도로교통법」상 도로{도로교통법 제44조(술에 취한 상태에서 의 운전금지)·제45조(과로한 때 등의 운전 금지)·제54조(사고발생 시의 조치) 제1항·제148조(벌칙) 및 제148조의2(벌칙)의 경우에는 도로 외의 곳을 포함}에서 자동차 또는 건설기계를 그 본래의 사용방법에 따라 사용하 는 것을 말합니다. 8. 운행5) : 사람 또는 물건의 운송 여부와 관계없이 자동차를 그 용법에 따라 사용하거나 관리하는 것을 말합니다(「자동차손해배상보장법」 제2조 제2호) 9. 음주운전(조종) : 「도로교통법」에 정한 술에 취한 상태에서 운전(조종)하거 나 음주측정에 불응하는 행위를 말합니다. 10. 의무보험: 「자동차손해배상보장법」 제5조에 따라 자동차보유자가 의무적 으로 가입하는 보험을 말합니다. 11. 자동차보유자 : 자동차의 소유자나 자동차를 사용할 권리가 있는 자로서 자기를 위하여 자동차를 운행하는 자를 말합니다(「자동차손해배상보장법」 제2조 제3호) 12. 자동차 취급업자 : 자동차정비업, 대리운전업, 주차장업, 급유업, 세차업, 자동차판매업, 자동차탁송업 등 자동차를 취급하는 것을 업으로 하는 자 (이들의 피용자6) 및 이들이 법인인 경우에는 그 이사와 감사를 포함)를 말 합니다. 4) 법령 자동차관리법 제3장 제29조를 말합니다. 금지되어 있는 물건 자동차운행에 있어 본인 및 다른 차량의 운행에 지장을 주는 것으로 예를 들어 기준밝기를 초과한 램프등, 번호판 가림장치 등을 말합니다. 5) 운전과 운행의 차이 예) 차도리씨는 서울에서 차량을 운전하여 부산에 도착 후 공영주차장에 주차를 했습니다. 여기에서 “운전”이란 차도리씨가 서울에서 부산까지 차량을 본래의 사용방법에 따라 사용한 것을 말하고, “운행”이란 운전 종료 후 주차가 된 상황 및 이후 관리 상태까지 포함하는 것을 말합니다. 따라서 운행은 운전보다 넓은 개념에 해당합니다. 6) 피용자(被傭者) 사용자에게 고용되어 사업이나 사업장에 노동력 등을 제공하는 사람을 말합니다. 13. 피보험자 : 보험회사에 보상을 청구할 수 있는 자로서 다음 중 어느 하나 에 해당하는 자를 말하며, 구체적인 피보험자의 범위는 각각의 보장종목에 서 정하는 바에 따릅니다. 가. 기명피보험자: 피보험자동차를 소유ㆍ사용ㆍ관리하는 자 중에서 보험 계약자가 지정하여 보험증권의 기명피보험자란에 기재되어 있는 피보 험자를 말합니다. 나. 친족피보험자 : 기명피보험자와 같이 살거나 살림을 같이 하는 친족7) 으로서 피보험자동차를 사용하거나 관리하고 있는 자를 말합니다. 다. 승낙피보험자 : 기명피보험자의 승낙을 얻어 피보험자동차를 사용하거 나 관리하고 있는 자를 말합니다. 라. 사용피보험자 : 기명피보험자의 사용자8) 또는 계약에 따라 기명피보험 자의 사용자에 준하는 지위를 얻은 자. 다만, 기명피보험자가 피보험자 동차를 사용자의 업무에 사용하고 있는 때에 한합니다. 마. 운전피보험자 : 다른 피보험자(기명피보험자, 친족피보험자, 승낙피보 험자, 사용피보험자를 말함)를 위하여 피보험자동차를 운전 중인 자(운 전보조자9)를 포함)를 말합니다. 14. 피보험자동차 : 보험증권에 기재된 자동차를 말합니다. 15. 피보험자의 부모, 배우자, 자녀 가. 피보험자의 부모 : 피보험자의 부모, 양부모를 말합니다. 나. 피보험자의 배우자 : 법률상의 배우자 또는 사실혼관계에 있는 배우자 를 말합니다. 다. 피보험자의 자녀 : 법률상의 혼인관계에서 출생한 자녀, 사실혼10)관계 에서 출생한 자녀, 양자 또는 양녀를 말합니다. 16. 휴대품, 인명보호장구 및 소지품11) 가. 휴대품 : 통상적으로 몸에 지니고 있는 물품으로 현금, 유가증권, 만년 필, 소모품, 손목시계, 귀금속, 장신구, 그 밖에 이와 유사한 물품을 말 합니다. 나. 인명보호장구 : 외부충격으로부터 탑승자의 신체를 보호하는 특수기 능이 포함된 것으로 「도로교통법 시행규칙」 제32조에서 정하는 승차용 안전모 또는 전용의류(*1)를 말합니다. 다. 소지품 : 휴대품을 제외한 물품으로 정착(*2)되어 있지 않고 휴대할 수 있는 물품을 말합니다.(*3) (*1) 예 : 바이크 전용 슈트, 에어백 등(라이더자켓ㆍ팬츠ㆍ부츠 등 이와 유사한 일반의류는 제외) 7) 같이 살거나 살림을 같이하는 친족(親族) 기명피보험자와 동일가옥에 살거나, 또는 민법 제777조 (친족: 8촌 이내의 혈족, 4촌 이내의 인척, 그리고 배우자)에 의해 생계를 같이하거나 부양관계에 있는 사람을 말합니다. 8) 사용자(使用者) 근로자(피용자)에 대하여 지휘명령을 하는 자로서 사업주, 경영담당자 등을 말합니다. 9) 운전보조자 업무로서 운전자의 운전행위에 참여하여 그 지배 하에서 운전행위를 도와주는 자로서, 통상 조수나 차장 등이 이에 속합니다. 업무와 관련 없는 선의의 보조행위(예 : 길 가던 행인의 일 시적 보조행위 등)는 이에 속하지 않습니다. 10) 사실혼 결혼을 하지 않았지만 실제 부부공동생활을 영위하며 사실상 혼인생활을 하고 있는 것으 로 단순 동거와는 구별됩니다. 11) 휴대품과 소지품의 차이 휴대품은 사고당시 휴대여부가 불명확하여 실제로 가지고 있었는지 확인이 불가하기 때문에 보상 받을 수 없으나, 소지품은 파손에 대한 흔적이 남아있기 때문에 보상받을 수 있습니다. 단, 소지품 의 경우라도 도난, 분실에 대하여는 보상받을 수 없습니다. 예) 사고발생시 지갑 속에 있던 현금은 보상받을 수 없지만, 파손된 휴대폰은 보상받을 수 있습니다.  (*2) 정착 : 볼트, 너트 등으로 고정되어 있어서 공구 등을 사용하지 않으면 쉽게 분리할 수 없는 상태 (*3) 예 : 휴대전화기, 노트북, 캠코더, 카메라, 음성재생기(CD 플레이어, MP3 플 레이어, 카세트테이프 플레이어 등), 녹음기, 전자수첩, 전자사전, 휴대용라디 오, 핸드백, 서류가방, 골프채 등 17. 사고발생 시의 조치의무 위반 : 「도로교통법」에서 정한 사고발생 시의 조 치를 하지 않은 경우를 말합니다. 다만, 주·정차된 차만 손괴한 것이 분명 한 경우에 피해자에게 인적사항을 제공하지 아니한 경우는 제외합니다. 18. 보험가액 가. 보험계약을 체결하는 경우 보험계약 체결 당시 보험개발원이 정한 최 근의 자동차보험 차량기준가액표(적용요령 포함)에 정한 가액을 말합 니다. 나. 보험계약 체결 후 사고가 발생한 경우 보험사고 발생 당시 보험개발원 이 정한 최근의 자동차보험 차량기준가액표(적용요령 포함)에 정한 가 액을 말합니다. 19. 마약ㆍ약물운전 : 마약 또는 약물 등의 영향으로 인하여 정상적인 운전을 하지 못할 우려가 있는 상태에서 운전하는 행위를 말합니다.",22
hanwha_gain_241216,보통약관,test,제2조(자동차보험의 구성),test2,"① 보험회사가 판매하는 자동차보험은 「대인배상Ⅰ」, 「대인배상Ⅱ」, 「대물배상」, 「자기신체사고」, 「무보험자동차에 의한 상해」, 「자기차량손해」의 6가지 보장 종목과 특별약관으로 구성되어 있습니다. ② 보험계약자는 다음과 같은 방법에 의해 자동차보험에 가입합니다. 1. 의무보험 : 「자동차손해배상보장법」 제5조에 의해 보험에 가입할 의무가 있는 자동차보유자는 「대인배상Ⅰ」과 「대물배상」(「자동차손해배상보장법」 에서 정한 보상한도12)에 한함)을 반드시 가입하여야 합니다. 2. 임의보험 : 의무보험에 가입하는 보험계약자는 의무보험에 해당하지 않는 보장종목을 선택하여 가입할 수 있습니다. ③ 각 보장종목별 보상 내용은 다음과 같으며 상세한 내용은 제2편 자동차보험 에서 보상하는 내용에 규정되어 있습니다. 1. 배상책임 : 자동차사고로 인하여 피보험자가 손해배상책임을 짐으로써 입 은 손해를 보상 <table> <tr> <td>보장종목</td> <td>보상하는 내용</td> </tr> <tr> <td rowspan=""2"">가. 「대인배상Ⅰ」</td> <td rowspan=""2"">자동차사고로 다른 사람을 죽게 하거나 다치게 한 경우에 「자동<br/>차손해배상보장법」에서 정한 한도에서 보상</td> </tr> <tr> </tr> <tr> <td>나. 「대인배상Ⅱ」</td> <td>자동차사고로 다른 사람을 죽게 하거나 다치게 한 경우, 그 손<br/>해가 「대인배상Ⅰ」에서 지급하는 금액을 초과하는 경우에 그 초<br/>과손해를 보상</td> </tr> <tr> <td>다. 「대물배상」</td> <td>자동차사고로 다른 사람의 재물을 없애거나 훼손한 경우에 보상</td> </tr> </table> 2. 배상책임 이외의 보장종목 : 자동차사고로 인하여 피보험자가 입은 손해를 보상 12) 자동차손해배상보장법 시행령 제3조에서 정하는 금액을 말합니다. <table> <tr> <td>보장종목</td> <td>보상하는 내용</td> </tr> <tr> <td>가. 「자기신체사고」</td> <td>피보험자가 죽거나 다친 경우에 보상</td> </tr> <tr> <td>나. 「무보험자동차에<br/>의한 상해」</td> <td>무보험자동차에 의해 피보험자가 죽거나 다친 경우에 보상</td> </tr> <tr> <td>다. 「자기차량손해」</td> <td>피보험자동차에 생긴 손해를 보상</td> </tr> </table> ④ 자동차보험료는 보험회사가 금융감독원에 신고한 후 사용하는 ‘자동차보험 요율서’에서 정한 방법에 의하여 계산합니다. &lt;예시&gt; <img alt=""[contents]가입자특성요율 납입할 기본 특약 = × × (보험가입경력요율 × 보험료 보험료 요율 교통법규위반경력요율) 특별 우량할인· 사고건수별 × × × 요율 불량할증요율 특성요율[/contents]"" src=""api/v1/file/result/doc?docResultPath=hanwha_gain_241216.pdf/v1/hanwha_gain_241216.pdf/./figures/hanwha_gain_241216_page24_paragraph20_figure.jpg""/> <table> <tr> <td>구분</td> <td>내용</td> </tr> <tr> <td>기본보험료</td> <td>차량의 종류, 배기량, 용도, 보험가입금액, 성별, 연령 등에 따라<br/>미리 정해놓은 기본적인 보험료</td> </tr> <tr> <td>특약요율</td> <td>운전자의 연령범위를 제한하는 특약, 가족으로 운전자를 한정하<br/>는 특약 등 가입 시에 적용하는 요율</td> </tr> <tr> <td>가입자특성요율</td> <td>보험가입기간이나 법규위반경력에 따라 적용하는 요율</td> </tr> <tr> <td>특별요율13)</td> <td>자동차의 구조나 운행실태가 같은 종류의 차량과 다른 경우 적<br/>용하는 요율</td> </tr> <tr> <td>우량할인.<br/>불량할증요율14)</td> <td>사고발생 실적에 따라 적용하는 요율</td> </tr> <tr> <td>사고건수별<br/>특성요율</td> <td>직전 3년간 사고유무 및 사고건수에 따라 적용하는 요율</td> </tr> </table> ※ 자동차보험료 계산에 관한 세부적인 사항은 각 보험회사별로 일부 상이 13) 특별요율 예) 에어백, 도난방지장치 등에 따른 특별요율이 있습니다. 14) 우량할인ㆍ불량할증요율 사고발생 내용(인적사고의 상해정도, 물적사고의 손해액 크기)에 따라 점수를 부과하여 적용하는 요율입니다.  제2편 자동차보험에서 보상하는 내용 제1장 배상책임 제1절 대인배상Ⅰ",24
hanwha_gain_241216,보통약관,test,제3조(보상하는 손해),test2,「대인배상Ⅰ」에서 보험회사는 피보험자가 피보험자동차의 운행으로 인하여 다 른 사람을 죽거나 다치게 하여 「자동차손해배상보장법」 제3조에 의한 손해배상 책임을 짐으로써 입은 손해를 보상합니다. ,25
hanwha_gain_241216,보통약관,test,제4조(피보험자),test2,"「대인배상Ⅰ」에서 피보험자라 함은 다음 중 어느 하나에 해당하는 자를 말하며, 다음에서 정하는 자 외에도 「자동차손해배상보장법」상 자동차보유자에 해당하 는 자가 있는 경우에는 그 자를 「대인배상Ⅰ」의 피보험자로 봅니다. 1. 기명피보험자 2. 친족피보험자 3. 승낙피보험자 4. 사용피보험자 5. 운전피보험자 ",25
hanwha_gain_241216,보통약관,test,제5조(보상하지 않는 손해)15),test2,"보험계약자 또는 피보험자의 고의16)로 인한 손해는 「대인배상Ⅰ」에서 보상하지 않습니다. 다만, 「자동차손해배상보장법」 제10조의 규정에 따라 피해자가 보험 회사에 직접청구를 한 경우, 보험회사는 자동차손해배상보장법령에서 정한 금 액을 한도로 피해자에게 손해배상금을 지급한 다음 지급한 날부터 3년 이내에 고의로 사고를 일으킨 보험계약자나 피보험자에게 그 금액의 지급을 청구합니 다.17) 15) 피보험자 고의로 손해발생시 피해자 구제를 위해 다음과 같이 진행됩니다. 예) ① 피보험자 고의에 의한 사고로 보험회사는 손해배상금 미지급 ② 피보험자가 피해자에게 자기부담을 통해 손해배상금을 지급하지 않는 경우 피해자는 자동 차손해배상보장법 제10조에 따라 가해자의 보험회사에 손해배상금 지급 청구 ③ 피보험자의 보험회사는 피해자에게 손해배상금 지급 ④ 피해자에게 지급한 손해배상금에 대하여 피보험자에게 청구(3년 이내) ⑤ 피보험자는 보험회사에 피해자에게 지급한 손해배상금 전액 지급 16) 고의(故意) 자기의 행위에 의하여 일정한 결과가 생길 것을 알면서 그 행위를 하는 경우를 말합니 다. 고의로 인한 손해는 관련 법령에 따라 형사처벌 등을 받을 수 있습니다. 17) 예) <img alt=""[contents]회 사 구상금 지급 ④구상금 지급 ①손해배상금 청구 ③구상청구 ②손해배상금 지급 피보험자 피해자[/contents]"" src=""api/v1/file/result/doc?docResultPath=hanwha_gain_241216.pdf/v1/hanwha_gain_241216.pdf/./figures/hanwha_gain_241216_page25_paragraph22_figure.jpg""/> ※ 단, 손해배상금 지급 및 구상청구는 대인배상Ⅰ(책임)보험금 한도 금액 범위 내로 합니다. 제2절 대인배상Ⅱ와 대물배상 ",25
